{"artifact_class":"a0r2-publication-manifest","claim_ids":[],"created_at":"2026-08-17T06:15:14Z","empirical":true,"evidence_eligible":false,"expert_validated":false,"protocol":{"path":"experiments/a0r2-independent-model/study-protocol.json","sha256":"383c2fe8a0d2baa893bc88326e3a5e18329691a90fd9bd1ea106602c8ee9bf3f"},"protocol_id":"a0r2-independent-model-v1.0.0","publication":{"claim_promotion":false,"model_substitution_after_output":false,"publish_every_terminal_outcome":true,"sensitivity_may_rescue_primary":false},"report":{"path":"report.md","sha256":"6141debee5999d1ca272536f75ad36659ffe638b27bf8bb480ba18fc40b39732"},"result":{"path":"run-failure.json","sha256":"d7dbe5b7da3dea2f51362ea05acadb04f5176f7ad193bb19c028d766eda782b5"},"scientific_status":"exploratory","status":"failed","terminal_status":"failed"}
