{"artifact_class":"a0r2-publication-manifest","claim_ids":[],"created_at":"2026-08-17T18:54:30Z","dense":{"hidden_size":960,"path":"artifacts/a0r2/a0r2c2-v1.0.0-f8027fd0-r1/activations.json","records":1920,"sha256":"20a377922b77ac5be0bb212a21d1a7413c33b4dd03cf47c8f98f0c1348388d9f"},"empirical":true,"evidence_eligible":false,"expert_validated":false,"index":{"path":"representations-index.jsonl","sha256":"baa78647fcc01c1d71cf27ef1c1fd83c6e38feb2a9a54a58fab87f245c63fc58"},"protocol":{"path":"experiments/a0r2-independent-model/study-protocol.json","sha256":"383c2fe8a0d2baa893bc88326e3a5e18329691a90fd9bd1ea106602c8ee9bf3f"},"protocol_id":"a0r2-independent-model-v1.0.0","publication":{"claim_promotion":false,"model_substitution_after_output":false,"publish_every_terminal_outcome":true,"sensitivity_may_rescue_primary":false},"receipt":{"path":"activation-receipt.json","sha256":"a96048812d95a3bee40f565b57b13bb45a495079b5c3605ac84e15845074cc15"},"report":{"path":"report.md","sha256":"9eb1c05f767231f35620d3baa88cc289560102673838662a4f2cdd4f5d53aaa1"},"result":{"path":"statistical-result.json","sha256":"81714e36a5fd29b8997cf3bbefc88857d90905df4702f2b20cfdd1dbbf91b4a0"},"scientific_status":"exploratory","status":"positive","terminal_status":"positive"}
